author,body,score,link
Complex-Ad-1106,"có gì không tức nha sự thật nó buồn tí biết đâu bớt lên internet nói nhảm thì có anh trai nào an ủi, chăm lo cho. ![img](emote|t5_4bcops|21248)",1,https://www.reddit.com/r/TroChuyenLinhTinh/comments/18fkb3q/t%E1%BA%A1i_sao_l%E1%BA%AFm_%C4%91%E1%BB%A9a_g%C3%A1i_vi%E1%BB%87t_th%C3%ADch_l%E1%BA%A5y_ch%E1%BB%93ng_t%C3%A2y/
gustavojesusgaviria,"Tốt nhất nên ngậm mồm suy nghĩ cho kỹ hẵng nói, không lại bị kêu ngu",1,https://www.reddit.com/r/TroChuyenLinhTinh/comments/18fkb3q/t%E1%BA%A1i_sao_l%E1%BA%AFm_%C4%91%E1%BB%A9a_g%C3%A1i_vi%E1%BB%87t_th%C3%ADch_l%E1%BA%A5y_ch%E1%BB%93ng_t%C3%A2y/
Complex-Ad-1106,"![img](emote|t5_4bcops|21248) ""Tốt nhất nên ngậm mồm suy nghĩ cho kỹ hẵng nói, không lại bị kêu ngu""![img](emote|t5_4bcops|22267)![img](emote|t5_4bcops|22267)![img](emote|t5_4bcops|22267)",1,https://www.reddit.com/r/TroChuyenLinhTinh/comments/18fkb3q/t%E1%BA%A1i_sao_l%E1%BA%AFm_%C4%91%E1%BB%A9a_g%C3%A1i_vi%E1%BB%87t_th%C3%ADch_l%E1%BA%A5y_ch%E1%BB%93ng_t%C3%A2y/
ngocanhispunk,bài hay chất lượng :)),2,https://www.reddit.com/r/TroChuyenLinhTinh/comments/18fkb3q/t%E1%BA%A1i_sao_l%E1%BA%AFm_%C4%91%E1%BB%A9a_g%C3%A1i_vi%E1%BB%87t_th%C3%ADch_l%E1%BA%A5y_ch%E1%BB%93ng_t%C3%A2y/
[deleted],Đứa nào thích lấy thì lấy thôi kệ tụi nó đi ![img](emote|t5_4bcops|22267),2,https://www.reddit.com/r/TroChuyenLinhTinh/comments/18fkb3q/t%E1%BA%A1i_sao_l%E1%BA%AFm_%C4%91%E1%BB%A9a_g%C3%A1i_vi%E1%BB%87t_th%C3%ADch_l%E1%BA%A5y_ch%E1%BB%93ng_t%C3%A2y/
LFTtruth,Quốc tịch Mỹ thì mấy em khoái khoái chảy nước miếng,3,https://www.reddit.com/r/TroChuyenLinhTinh/comments/18fkb3q/t%E1%BA%A1i_sao_l%E1%BA%AFm_%C4%91%E1%BB%A9a_g%C3%A1i_vi%E1%BB%87t_th%C3%ADch_l%E1%BA%A5y_ch%E1%BB%93ng_t%C3%A2y/
[deleted],Như thằng lồn khùng!!!,-1,https://www.reddit.com/r/TroChuyenLinhTinh/comments/18fkb3q/t%E1%BA%A1i_sao_l%E1%BA%AFm_%C4%91%E1%BB%A9a_g%C3%A1i_vi%E1%BB%87t_th%C3%ADch_l%E1%BA%A5y_ch%E1%BB%93ng_t%C3%A2y/
[deleted],[removed],11,https://www.reddit.com/r/TroChuyenLinhTinh/comments/18fkb3q/t%E1%BA%A1i_sao_l%E1%BA%AFm_%C4%91%E1%BB%A9a_g%C3%A1i_vi%E1%BB%87t_th%C3%ADch_l%E1%BA%A5y_ch%E1%BB%93ng_t%C3%A2y/
TheHabeo,Thằng Jake and Bake nhìn cũng ok đấy ![img](emote|t5_4bcops|22267),2,https://www.reddit.com/r/TroChuyenLinhTinh/comments/18fkb3q/t%E1%BA%A1i_sao_l%E1%BA%AFm_%C4%91%E1%BB%A9a_g%C3%A1i_vi%E1%BB%87t_th%C3%ADch_l%E1%BA%A5y_ch%E1%BB%93ng_t%C3%A2y/
Ready_Cupcake9873,"Củ nó to ..kkkkk... mấy đứa đó hay xem xvidoes nên thần tượng .. mịa tây dễ ăn của nó lắm .. cao lắm nó mua cho cái nhà ở chung , tiền nó làm thì nó giữ chỉ ói ra những chi phí chung nuôi con ..mịa gặp thằng keo bẩn thì khỏi phải nói ..",7,https://www.reddit.com/r/TroChuyenLinhTinh/comments/18fkb3q/t%E1%BA%A1i_sao_l%E1%BA%AFm_%C4%91%E1%BB%A9a_g%C3%A1i_vi%E1%BB%87t_th%C3%ADch_l%E1%BA%A5y_ch%E1%BB%93ng_t%C3%A2y/
