author,body,score,link
Ok-Physics-8298,Nói vậy chứ Tây nó đc dạy che cái xấu phô cái tốt ra. Sống lâu mới thấm,2,https://www.reddit.com/r/TroChuyenLinhTinh/comments/18fkb3q/t%E1%BA%A1i_sao_l%E1%BA%AFm_%C4%91%E1%BB%A9a_g%C3%A1i_vi%E1%BB%87t_th%C3%ADch_l%E1%BA%A5y_ch%E1%BB%93ng_t%C3%A2y/
Objective_Function46,"Đéo mẹ 1 thằng cao gần mét 8 (m79), cu 18cm, biết quan tâm, ga lăng và phóng khoáng như tao đọc mà cảm thấy chạnh lòng. Khổ ![img](emote|t5_4bcops|21259)",4,https://www.reddit.com/r/TroChuyenLinhTinh/comments/18fkb3q/t%E1%BA%A1i_sao_l%E1%BA%AFm_%C4%91%E1%BB%A9a_g%C3%A1i_vi%E1%BB%87t_th%C3%ADch_l%E1%BA%A5y_ch%E1%BB%93ng_t%C3%A2y/
irisnguyen279,"Ham tiền, đơn giản",2,https://www.reddit.com/r/TroChuyenLinhTinh/comments/18fkb3q/t%E1%BA%A1i_sao_l%E1%BA%AFm_%C4%91%E1%BB%A9a_g%C3%A1i_vi%E1%BB%87t_th%C3%ADch_l%E1%BA%A5y_ch%E1%BB%93ng_t%C3%A2y/
Mackey_Nguyen,"6, Nó ít tư tưởng trọng nam khinh nữ hơn đàn ông VN",7,https://www.reddit.com/r/TroChuyenLinhTinh/comments/18fkb3q/t%E1%BA%A1i_sao_l%E1%BA%AFm_%C4%91%E1%BB%A9a_g%C3%A1i_vi%E1%BB%87t_th%C3%ADch_l%E1%BA%A5y_ch%E1%BB%93ng_t%C3%A2y/
nhantran9071,Cư bụ,2,https://www.reddit.com/r/TroChuyenLinhTinh/comments/18fkb3q/t%E1%BA%A1i_sao_l%E1%BA%AFm_%C4%91%E1%BB%A9a_g%C3%A1i_vi%E1%BB%87t_th%C3%ADch_l%E1%BA%A5y_ch%E1%BB%93ng_t%C3%A2y/
jude1903,"Tây cũng tây this tây that nhé, tây this thì ít mà tây that thì nhiều, mấy em vn đua đòi dễ vỡ mộng lol",6,https://www.reddit.com/r/TroChuyenLinhTinh/comments/18fkb3q/t%E1%BA%A1i_sao_l%E1%BA%AFm_%C4%91%E1%BB%A9a_g%C3%A1i_vi%E1%BB%87t_th%C3%ADch_l%E1%BA%A5y_ch%E1%BB%93ng_t%C3%A2y/
DepartureFew5189,M ngon hơn th Tây thì m vẫn có lựa chọn thôi. Gái chỉ thích mồi ngon mồi nào ngon nhất thì nó lấy thế thôi. Lắm th giàu có cả khối gái xinh kia mắc gì so sánh với Tây Lông đi cặp mấy con nhà quê làm gì. Money and status bring forth value of a man.,12,https://www.reddit.com/r/TroChuyenLinhTinh/comments/18fkb3q/t%E1%BA%A1i_sao_l%E1%BA%AFm_%C4%91%E1%BB%A9a_g%C3%A1i_vi%E1%BB%87t_th%C3%ADch_l%E1%BA%A5y_ch%E1%BB%93ng_t%C3%A2y/
South_Job6979,"Nghe phân tích xong tui muốn chui xuống abyss quá, tui muốn thành bondrewd ![img](emote|t5_4bcops|22262)![img](emote|t5_4bcops|22262)![img](emote|t5_4bcops|22262)![img](emote|t5_4bcops|22262)![img](emote|t5_4bcops|22262)",1,https://www.reddit.com/r/TroChuyenLinhTinh/comments/18fkb3q/t%E1%BA%A1i_sao_l%E1%BA%AFm_%C4%91%E1%BB%A9a_g%C3%A1i_vi%E1%BB%87t_th%C3%ADch_l%E1%BA%A5y_ch%E1%BB%93ng_t%C3%A2y/
onizuka11,Cặc Tây bự đụ đã hơn cặc An Nam.,1,https://www.reddit.com/r/TroChuyenLinhTinh/comments/18fkb3q/t%E1%BA%A1i_sao_l%E1%BA%AFm_%C4%91%E1%BB%A9a_g%C3%A1i_vi%E1%BB%87t_th%C3%ADch_l%E1%BA%A5y_ch%E1%BB%93ng_t%C3%A2y/
Ok_Worldliness4120,còn gì ngoài quốc tịch xứ tư bản G7,2,https://www.reddit.com/r/TroChuyenLinhTinh/comments/18fkb3q/t%E1%BA%A1i_sao_l%E1%BA%AFm_%C4%91%E1%BB%A9a_g%C3%A1i_vi%E1%BB%87t_th%C3%ADch_l%E1%BA%A5y_ch%E1%BB%93ng_t%C3%A2y/
Powerful-Scholar6923,"Ở các phòng gym California mà tao tập liên tục 3 - 4 năm trước, thấy rõ điều thằng OP viết : có 1 dạo, tụi gái Việt tập ở đó đi nhuộm da thành da nâu, tao nhìn không thích, sau mới hiểu tụi Tây lông khoái gái da ngăm, có thể tụi nó cho là vậy mới có tình dục mạnh 😜🤪🤪

từ đực tới cái, đặc biệt là giống cái, mê Tây tới mức muốn tung cái LỒN vô mặt tụi Tây luôn á. Từ đực tới cái cứ Tây bắt chuyện là như bắt được vàng, còn ta (tức người Việt) thử bắt quen với tụi gái ngon chút thì có cứt tụi nó thèm trả lời 😜🤪🤪😜",10,https://www.reddit.com/r/TroChuyenLinhTinh/comments/18fkb3q/t%E1%BA%A1i_sao_l%E1%BA%AFm_%C4%91%E1%BB%A9a_g%C3%A1i_vi%E1%BB%87t_th%C3%ADch_l%E1%BA%A5y_ch%E1%BB%93ng_t%C3%A2y/
[deleted],"Người Việt ở xứ nóng nên da ngăm tự nhiên, mắc gì phải nhuộm?",3,https://www.reddit.com/r/TroChuyenLinhTinh/comments/18fkb3q/t%E1%BA%A1i_sao_l%E1%BA%AFm_%C4%91%E1%BB%A9a_g%C3%A1i_vi%E1%BB%87t_th%C3%ADch_l%E1%BA%A5y_ch%E1%BB%93ng_t%C3%A2y/
TheDankThings98,Tao biết chuyện có 2 con vào thùng sốp vì cưới phải thằng Romania nhé nên các e nứng lồn nào định chơi lớn đổi đời thì quên đi,9,https://www.reddit.com/r/TroChuyenLinhTinh/comments/18fkb3q/t%E1%BA%A1i_sao_l%E1%BA%AFm_%C4%91%E1%BB%A9a_g%C3%A1i_vi%E1%BB%87t_th%C3%ADch_l%E1%BA%A5y_ch%E1%BB%93ng_t%C3%A2y/
SigmaSausage,có link không bác cho em đọc với,1,https://www.reddit.com/r/TroChuyenLinhTinh/comments/18fkb3q/t%E1%BA%A1i_sao_l%E1%BA%AFm_%C4%91%E1%BB%A9a_g%C3%A1i_vi%E1%BB%87t_th%C3%ADch_l%E1%BA%A5y_ch%E1%BB%93ng_t%C3%A2y/
Large-Fox-5705,"Cá nhân t thấy thời buổi hội nhập,mở cửa lấy ai là chuyện của nó,tây hay đâu thì cũng là chuyện bình thường.Nhưng chuyện có ràng buộc,danh phận-hôn nhân rõ ràng thì khác.Còn mấy con ngu vd như chi thằng travelvids chịch (quay clip-lộ mặt-cầm chứng minh thư cho nó chụp) xong cuối cùng nó đem cái clip đấy bán lấy tiền thì lại là 1 thể loại khác",11,https://www.reddit.com/r/TroChuyenLinhTinh/comments/18fkb3q/t%E1%BA%A1i_sao_l%E1%BA%AFm_%C4%91%E1%BB%A9a_g%C3%A1i_vi%E1%BB%87t_th%C3%ADch_l%E1%BA%A5y_ch%E1%BB%93ng_t%C3%A2y/
ILikeRandomShits,Riêng gì con gái. Tao cũng thích,5,https://www.reddit.com/r/TroChuyenLinhTinh/comments/18fkb3q/t%E1%BA%A1i_sao_l%E1%BA%AFm_%C4%91%E1%BB%A9a_g%C3%A1i_vi%E1%BB%87t_th%C3%ADch_l%E1%BA%A5y_ch%E1%BB%93ng_t%C3%A2y/
Iavaomombodo,"vì đàn ông việt ngu , lùn ,còi cọc cơ teo parky thì gia trưởng ăn tục bốc phét , nam cầy mọi miên thì tướng như nô lệ da đen răng hô mắt trố hạ đẳng mạt hạng đáy xã hội , chim bé còn dễ mắc bệnh bê đê .",7,https://www.reddit.com/r/TroChuyenLinhTinh/comments/18fkb3q/t%E1%BA%A1i_sao_l%E1%BA%AFm_%C4%91%E1%BB%A9a_g%C3%A1i_vi%E1%BB%87t_th%C3%ADch_l%E1%BA%A5y_ch%E1%BB%93ng_t%C3%A2y/
happaduchy,Mày tự nhục thôi thì ko sao nhá. Nhưng chắc không dám ăn nói ntn trc mặt bố mẹ và tổ tiên,2,https://www.reddit.com/r/TroChuyenLinhTinh/comments/18fkb3q/t%E1%BA%A1i_sao_l%E1%BA%AFm_%C4%91%E1%BB%A9a_g%C3%A1i_vi%E1%BB%87t_th%C3%ADch_l%E1%BA%A5y_ch%E1%BB%93ng_t%C3%A2y/
Iavaomombodo," nhà tao ít người mà toàn thằng tao to đẹp trai 1m78 trở lên , thằng nào cũng có tiền ở sống nước ngoài , tao giờ còn về làm công an dự 10 năm nữa ngồi trên đầu trên cổ lũ dân đen mạt hạng chúng mày ,  thế chăc đéo phải gốc vịt rồi",3,https://www.reddit.com/r/TroChuyenLinhTinh/comments/18fkb3q/t%E1%BA%A1i_sao_l%E1%BA%AFm_%C4%91%E1%BB%A9a_g%C3%A1i_vi%E1%BB%87t_th%C3%ADch_l%E1%BA%A5y_ch%E1%BB%93ng_t%C3%A2y/
DirectorBitter3273,"chửi chính cái gốc gác của mình =)))) 1m78 thì đã là cgi, ôn con chắc vẫn tuổi teen mà láo",1,https://www.reddit.com/r/TroChuyenLinhTinh/comments/18fkb3q/t%E1%BA%A1i_sao_l%E1%BA%AFm_%C4%91%E1%BB%A9a_g%C3%A1i_vi%E1%BB%87t_th%C3%ADch_l%E1%BA%A5y_ch%E1%BB%93ng_t%C3%A2y/
Ambitious_Bat_3141,tự hào vì thành 1 thằng khốn nạn như m thì thà lm dân đen còn hơn con ạ,1,https://www.reddit.com/r/TroChuyenLinhTinh/comments/18fkb3q/t%E1%BA%A1i_sao_l%E1%BA%AFm_%C4%91%E1%BB%A9a_g%C3%A1i_vi%E1%BB%87t_th%C3%ADch_l%E1%BA%A5y_ch%E1%BB%93ng_t%C3%A2y/
DepartureFew5189,Mỗi mình mày tự nhận dép ai thèm hùa theo đm m nằm dưới lỗ đít xã hội còn không biết nâng mình lên thì mày nằm chết cho sâu vào đừng góp già tất cả đàn ô Vn vào,3,https://www.reddit.com/r/TroChuyenLinhTinh/comments/18fkb3q/t%E1%BA%A1i_sao_l%E1%BA%AFm_%C4%91%E1%BB%A9a_g%C3%A1i_vi%E1%BB%87t_th%C3%ADch_l%E1%BA%A5y_ch%E1%BB%93ng_t%C3%A2y/
Iavaomombodo," ngu ,",1,https://www.reddit.com/r/TroChuyenLinhTinh/comments/18fkb3q/t%E1%BA%A1i_sao_l%E1%BA%AFm_%C4%91%E1%BB%A9a_g%C3%A1i_vi%E1%BB%87t_th%C3%ADch_l%E1%BA%A5y_ch%E1%BB%93ng_t%C3%A2y/
Kingelonmuss,"Trai VN nho giáo , gia trưởng ( nhất là parky ).
Đẻ con lai kute , cải thiện nồi giống",9,https://www.reddit.com/r/TroChuyenLinhTinh/comments/18fkb3q/t%E1%BA%A1i_sao_l%E1%BA%AFm_%C4%91%E1%BB%A9a_g%C3%A1i_vi%E1%BB%87t_th%C3%ADch_l%E1%BA%A5y_ch%E1%BB%93ng_t%C3%A2y/
Ambitious_Bat_3141,cái gene khmer cmay thì ăn tdn được bọn t đừng nói là tây,1,https://www.reddit.com/r/TroChuyenLinhTinh/comments/18fkb3q/t%E1%BA%A1i_sao_l%E1%BA%AFm_%C4%91%E1%BB%A9a_g%C3%A1i_vi%E1%BB%87t_th%C3%ADch_l%E1%BA%A5y_ch%E1%BB%93ng_t%C3%A2y/
Ambitious_Bat_3141,namky khác gì 😏,1,https://www.reddit.com/r/TroChuyenLinhTinh/comments/18fkb3q/t%E1%BA%A1i_sao_l%E1%BA%AFm_%C4%91%E1%BB%A9a_g%C3%A1i_vi%E1%BB%87t_th%C3%ADch_l%E1%BA%A5y_ch%E1%BB%93ng_t%C3%A2y/
ArtisticAd5251,"Gái lấy tây trình độ nào cũng có, nhưng qua bài viết của m t chỉ thấy m đang cố ép họ vào chung 1 đẳng cấp",16,https://www.reddit.com/r/TroChuyenLinhTinh/comments/18fkb3q/t%E1%BA%A1i_sao_l%E1%BA%AFm_%C4%91%E1%BB%A9a_g%C3%A1i_vi%E1%BB%87t_th%C3%ADch_l%E1%BA%A5y_ch%E1%BB%93ng_t%C3%A2y/
pshyduc,"Chuẩn, t người VN làm lương đủ ăn nuôi 1 mèo 1 chó còn thấy chẳng thấm vào đâu mà cạnh tranh thị trường quốc tế. Có cái mà thấy m chưa đề cập tới là vấn đề môn đăng hộ đối. M có thể kiểm soát được tất cả mọi thứ của cuộc đời nhưng kbh kiểm soát được nơi mày sinh ra và đấng sinh thành.

Gia đình người Bắc nên coi như thua, dễ gì mà có ai chịu làm dâu đất Bắc. T k gia trưởng cũng có ng nhà gia trưởng nữa là. Nhiều người nói chủ yếu do thằng ck thì xin lỗi, k thể bao giờ kiểm soát được 100%

\--- but it the end có khi đó là điều tốt nhất, sống độc thân sướng vl ra kk",10,https://www.reddit.com/r/TroChuyenLinhTinh/comments/18fkb3q/t%E1%BA%A1i_sao_l%E1%BA%AFm_%C4%91%E1%BB%A9a_g%C3%A1i_vi%E1%BB%87t_th%C3%ADch_l%E1%BA%A5y_ch%E1%BB%93ng_t%C3%A2y/
Beautiful-Wind579,Chỉ biết ước,1,https://www.reddit.com/r/TroChuyenLinhTinh/comments/18fkb3q/t%E1%BA%A1i_sao_l%E1%BA%AFm_%C4%91%E1%BB%A9a_g%C3%A1i_vi%E1%BB%87t_th%C3%ADch_l%E1%BA%A5y_ch%E1%BB%93ng_t%C3%A2y/
laturtlez, “Once you go black you never go back”  Câu hay v mà chưa nghe bh ta :DD,5,https://www.reddit.com/r/TroChuyenLinhTinh/comments/18fkb3q/t%E1%BA%A1i_sao_l%E1%BA%AFm_%C4%91%E1%BB%A9a_g%C3%A1i_vi%E1%BB%87t_th%C3%ADch_l%E1%BA%A5y_ch%E1%BB%93ng_t%C3%A2y/
Vast_Handle_2091,"Câu của mấy thằng da đen sinh ra trong gia đình tội phạm hoặc thiếu cha đấy m, có cak mà mày hỏi thằng da màu học thức cao phát ngôn câu đấy ![img](emote|t5_4bcops|21259)",3,https://www.reddit.com/r/TroChuyenLinhTinh/comments/18fkb3q/t%E1%BA%A1i_sao_l%E1%BA%AFm_%C4%91%E1%BB%A9a_g%C3%A1i_vi%E1%BB%87t_th%C3%ADch_l%E1%BA%A5y_ch%E1%BB%93ng_t%C3%A2y/
Powerful-Scholar6923,Bài viết hay 👍👍👍👍👍,1,https://www.reddit.com/r/TroChuyenLinhTinh/comments/18fkb3q/t%E1%BA%A1i_sao_l%E1%BA%AFm_%C4%91%E1%BB%A9a_g%C3%A1i_vi%E1%BB%87t_th%C3%ADch_l%E1%BA%A5y_ch%E1%BB%93ng_t%C3%A2y/
[deleted],"Lấy Tây hay ko ko quan trọng. Quan trọng là mấy con đó ko quay lại cắn đàn ông Việt thôi. Sgbb, hộ chiếu hunter, ko quan trọng... Gái Việt ngon nhất vx chỉ về tay đàn ông Việt thôi, mấy thk Tây cx ko húp đc mấy con cực phẩm đâu",8,https://www.reddit.com/r/TroChuyenLinhTinh/comments/18fkb3q/t%E1%BA%A1i_sao_l%E1%BA%AFm_%C4%91%E1%BB%A9a_g%C3%A1i_vi%E1%BB%87t_th%C3%ADch_l%E1%BA%A5y_ch%E1%BB%93ng_t%C3%A2y/
LuNgocBinBin,Đơn giản là quen xong mấy thằng tây thì mấy thằng asian khó mà lấp đầy được khoảng trống ![img](emote|t5_4bcops|21260),3,https://www.reddit.com/r/TroChuyenLinhTinh/comments/18fkb3q/t%E1%BA%A1i_sao_l%E1%BA%AFm_%C4%91%E1%BB%A9a_g%C3%A1i_vi%E1%BB%87t_th%C3%ADch_l%E1%BA%A5y_ch%E1%BB%93ng_t%C3%A2y/
Accomplished_Lie4673,"Nga cũng là Tây hả m? Hay m trừ cái này

Nam Mỹ có tính không",1,https://www.reddit.com/r/TroChuyenLinhTinh/comments/18fkb3q/t%E1%BA%A1i_sao_l%E1%BA%AFm_%C4%91%E1%BB%A9a_g%C3%A1i_vi%E1%BB%87t_th%C3%ADch_l%E1%BA%A5y_ch%E1%BB%93ng_t%C3%A2y/
Bitter_Professor1040,"Thông thường cụm từ ""các nước phương Tây"" là miêu tả mấy nước Tây Âu, Úc, và Mĩ. Còn các nước Đông Âu như Nga, hay các nước Mĩ Latinh thì không được tính là trời Tây.",1,https://www.reddit.com/r/TroChuyenLinhTinh/comments/18fkb3q/t%E1%BA%A1i_sao_l%E1%BA%AFm_%C4%91%E1%BB%A9a_g%C3%A1i_vi%E1%BB%87t_th%C3%ADch_l%E1%BA%A5y_ch%E1%BB%93ng_t%C3%A2y/
Kindly-dude1,"Nga, Nam Mỹ không giàu như Bắc Mỹ, Tây Âu, Úc nên thấy ít đứa chọn. Nga còn có vì còn dây mơ rễ má ít nhiều, chứ trai Nam Mỹ + gái Việt thì tao chưa bao giờ gặp",1,https://www.reddit.com/r/TroChuyenLinhTinh/comments/18fkb3q/t%E1%BA%A1i_sao_l%E1%BA%AFm_%C4%91%E1%BB%A9a_g%C3%A1i_vi%E1%BB%87t_th%C3%ADch_l%E1%BA%A5y_ch%E1%BB%93ng_t%C3%A2y/
ILikeRandomShits,Nga cũng chẳng giàu mấy đâu nên t thấy cx ít đứa chọn Nga,1,https://www.reddit.com/r/TroChuyenLinhTinh/comments/18fkb3q/t%E1%BA%A1i_sao_l%E1%BA%AFm_%C4%91%E1%BB%A9a_g%C3%A1i_vi%E1%BB%87t_th%C3%ADch_l%E1%BA%A5y_ch%E1%BB%93ng_t%C3%A2y/
[deleted],[deleted],1,https://www.reddit.com/r/TroChuyenLinhTinh/comments/18fkb3q/t%E1%BA%A1i_sao_l%E1%BA%AFm_%C4%91%E1%BB%A9a_g%C3%A1i_vi%E1%BB%87t_th%C3%ADch_l%E1%BA%A5y_ch%E1%BB%93ng_t%C3%A2y/
Beautiful-Wind579,Bỏ cuộc gì?,1,https://www.reddit.com/r/TroChuyenLinhTinh/comments/18fkb3q/t%E1%BA%A1i_sao_l%E1%BA%AFm_%C4%91%E1%BB%A9a_g%C3%A1i_vi%E1%BB%87t_th%C3%ADch_l%E1%BA%A5y_ch%E1%BB%93ng_t%C3%A2y/
SingedGodFeed,"Vụ quốc tịch tùy chứ? Vì đầy cặp mà kết hôn, con có quốc tịch, sắp đi đại học rồi mà vợ vẫn là thường trú nhân",1,https://www.reddit.com/r/TroChuyenLinhTinh/comments/18fkb3q/t%E1%BA%A1i_sao_l%E1%BA%AFm_%C4%91%E1%BB%A9a_g%C3%A1i_vi%E1%BB%87t_th%C3%ADch_l%E1%BA%A5y_ch%E1%BB%93ng_t%C3%A2y/
Aricingstar,Đấy là vì con vợ éo đi thi quốc tịch chứ có phải do thằng chồng đâu,1,https://www.reddit.com/r/TroChuyenLinhTinh/comments/18fkb3q/t%E1%BA%A1i_sao_l%E1%BA%AFm_%C4%91%E1%BB%A9a_g%C3%A1i_vi%E1%BB%87t_th%C3%ADch_l%E1%BA%A5y_ch%E1%BB%93ng_t%C3%A2y/
Icy-Trouble-7889,Luật mỗi nơi 1 khác ở mỹ 5 năm mới đc thi QT,1,https://www.reddit.com/r/TroChuyenLinhTinh/comments/18fkb3q/t%E1%BA%A1i_sao_l%E1%BA%AFm_%C4%91%E1%BB%A9a_g%C3%A1i_vi%E1%BB%87t_th%C3%ADch_l%E1%BA%A5y_ch%E1%BB%93ng_t%C3%A2y/
SingedGodFeed,:)) Không thi được thì đúng hơn chứ k phải k muốn thi,1,https://www.reddit.com/r/TroChuyenLinhTinh/comments/18fkb3q/t%E1%BA%A1i_sao_l%E1%BA%AFm_%C4%91%E1%BB%A9a_g%C3%A1i_vi%E1%BB%87t_th%C3%ADch_l%E1%BA%A5y_ch%E1%BB%93ng_t%C3%A2y/
Conganguoi,"Gái Tây cũng ngon vậy mày, gen trội, tự lập, mạnh mẽ, độc lập, đéo như mấy con bánh bèo Đông Lào đi đâu cũng chỉ xách cái lol đi thôi còn lại đòi hỏi đối tác đủ thứ",13,https://www.reddit.com/r/TroChuyenLinhTinh/comments/18fkb3q/t%E1%BA%A1i_sao_l%E1%BA%AFm_%C4%91%E1%BB%A9a_g%C3%A1i_vi%E1%BB%87t_th%C3%ADch_l%E1%BA%A5y_ch%E1%BB%93ng_t%C3%A2y/
Bitter_Professor1040,"Với bị cái giờ bên Tây chủ nghĩa nữ quyền nó hãm lồn quá. Đa phần gái Tây toàn mấy con cực tả. Mấy đứa mà bảo vệ truyền thống thì nó đâu thèm lấy châu Á làm gì, nó lấy chồng Tây để bảo vệ nòi giống, sắc đẹp cho con nó. Mấy đứa cực tả, chủ nghĩa nữ quyền xàm lờ thì cũng chọn chồng Tây, tại chồng Tây kiếm được nhiều tiền cho nó tiêu xài phung phí luôn.",1,https://www.reddit.com/r/TroChuyenLinhTinh/comments/18fkb3q/t%E1%BA%A1i_sao_l%E1%BA%AFm_%C4%91%E1%BB%A9a_g%C3%A1i_vi%E1%BB%87t_th%C3%ADch_l%E1%BA%A5y_ch%E1%BB%93ng_t%C3%A2y/
chananddat,"Mỗi tội của mấy con Tây chắc to , rộng hơn. Tiêu chí dv thỏa mãn cũng cao hơn nên mấy thằng Asian ko đánh dc",3,https://www.reddit.com/r/TroChuyenLinhTinh/comments/18fkb3q/t%E1%BA%A1i_sao_l%E1%BA%AFm_%C4%91%E1%BB%A9a_g%C3%A1i_vi%E1%BB%87t_th%C3%ADch_l%E1%BA%A5y_ch%E1%BB%93ng_t%C3%A2y/
Same-Instruction1922,?? asian tập là đánh được chả có vấn đề gì,1,https://www.reddit.com/r/TroChuyenLinhTinh/comments/18fkb3q/t%E1%BA%A1i_sao_l%E1%BA%AFm_%C4%91%E1%BB%A9a_g%C3%A1i_vi%E1%BB%87t_th%C3%ADch_l%E1%BA%A5y_ch%E1%BB%93ng_t%C3%A2y/
Mental_Frosting_7196,Uhm công nhận mày phân tích rất hợp lí có hiểu biết xã hội. Làm nghề j đấy fen.,5,https://www.reddit.com/r/TroChuyenLinhTinh/comments/18fkb3q/t%E1%BA%A1i_sao_l%E1%BA%AFm_%C4%91%E1%BB%A9a_g%C3%A1i_vi%E1%BB%87t_th%C3%ADch_l%E1%BA%A5y_ch%E1%BB%93ng_t%C3%A2y/
Littlelittleshy,"T là con gái t cũng thích chồng t là ng Châu Âu, đặc biệt là Bắc Âu. Nhìn xem mấy thằng VN ở trên sub này xem, toàn thất bại, đã nghèo, lười, lại còn bảo thủ, lại thêm cu ngắn quay tay nhiều xts nữa chứ. Nói chuyện thì lồn với cặc, ko tôn trọng, đặc biệt đối với phụ nữ. Trẻ trâu ko ra trẻ trâu, trưởng thành ko ra trưởng thành ![img](emote|t5_4bcops|22261)",28,https://www.reddit.com/r/TroChuyenLinhTinh/comments/18fkb3q/t%E1%BA%A1i_sao_l%E1%BA%AFm_%C4%91%E1%BB%A9a_g%C3%A1i_vi%E1%BB%87t_th%C3%ADch_l%E1%BA%A5y_ch%E1%BB%93ng_t%C3%A2y/
[deleted],Rồi mày xem Tây nó cụ thích dụ mấy con châu Á không,1,https://www.reddit.com/r/TroChuyenLinhTinh/comments/18fkb3q/t%E1%BA%A1i_sao_l%E1%BA%AFm_%C4%91%E1%BB%A9a_g%C3%A1i_vi%E1%BB%87t_th%C3%ADch_l%E1%BA%A5y_ch%E1%BB%93ng_t%C3%A2y/
Littlelittleshy,M nói gì t đéo hiểu cho lắm,1,https://www.reddit.com/r/TroChuyenLinhTinh/comments/18fkb3q/t%E1%BA%A1i_sao_l%E1%BA%AFm_%C4%91%E1%BB%A9a_g%C3%A1i_vi%E1%BB%87t_th%C3%ADch_l%E1%BA%A5y_ch%E1%BB%93ng_t%C3%A2y/
Billy-Butcher1066,Này miêu tả vozer với đa số mem xàm tràn qua sub này ấy hay sao ấy hả. Tụi nó k trẻ trâu đâu. Có thể gọi tụi nó già trâu mà. ![img](emote|t5_4bcops|21259).,8,https://www.reddit.com/r/TroChuyenLinhTinh/comments/18fkb3q/t%E1%BA%A1i_sao_l%E1%BA%AFm_%C4%91%E1%BB%A9a_g%C3%A1i_vi%E1%BB%87t_th%C3%ADch_l%E1%BA%A5y_ch%E1%BB%93ng_t%C3%A2y/
altair139,cái quan trọng là loser hay ko chứ trẻ hay già các chị e có vẻ đéo quan trọng lắm ![img](emote|t5_4bcops|21259). mà khoản loser thì mấy thằng trên này số 2 đéo ai số 1 ![img](emote|t5_4bcops|22267)![img](emote|t5_4bcops|22267),1,https://www.reddit.com/r/TroChuyenLinhTinh/comments/18fkb3q/t%E1%BA%A1i_sao_l%E1%BA%AFm_%C4%91%E1%BB%A9a_g%C3%A1i_vi%E1%BB%87t_th%C3%ADch_l%E1%BA%A5y_ch%E1%BB%93ng_t%C3%A2y/
gustavojesusgaviria,Con nào kêu lấy chồng Tây chắc tao còn ủng hộ thêm,2,https://www.reddit.com/r/TroChuyenLinhTinh/comments/18fkb3q/t%E1%BA%A1i_sao_l%E1%BA%AFm_%C4%91%E1%BB%A9a_g%C3%A1i_vi%E1%BB%87t_th%C3%ADch_l%E1%BA%A5y_ch%E1%BB%93ng_t%C3%A2y/
dangnguyen89,"Trai Việt cũng thích lấy gái Tây mà, vú mông đều bự hơn, chim hồng hơn, da trắng hơn, đẹp hơn, cải thiện nòi giống tốt hơn",7,https://www.reddit.com/r/TroChuyenLinhTinh/comments/18fkb3q/t%E1%BA%A1i_sao_l%E1%BA%AFm_%C4%91%E1%BB%A9a_g%C3%A1i_vi%E1%BB%87t_th%C3%ADch_l%E1%BA%A5y_ch%E1%BB%93ng_t%C3%A2y/
Jealous-Koala-5653,"Mà gái tây làm gì thích trai châu á, trai tây chim bự vcl tội gì ko lấy",5,https://www.reddit.com/r/TroChuyenLinhTinh/comments/18fkb3q/t%E1%BA%A1i_sao_l%E1%BA%AFm_%C4%91%E1%BB%A9a_g%C3%A1i_vi%E1%BB%87t_th%C3%ADch_l%E1%BA%A5y_ch%E1%BB%93ng_t%C3%A2y/
dangnguyen89,"Thì t mới nói là sở thích, chứ gen Vn có trội đâu, đa số toàn mấy con nghèo từ Đông Âu chạy qua nó mới chịu lấy trai Việt.",7,https://www.reddit.com/r/TroChuyenLinhTinh/comments/18fkb3q/t%E1%BA%A1i_sao_l%E1%BA%AFm_%C4%91%E1%BB%A9a_g%C3%A1i_vi%E1%BB%87t_th%C3%ADch_l%E1%BA%A5y_ch%E1%BB%93ng_t%C3%A2y/
[deleted],Thời kỳ suy thoái về mặt nhận thức của TCLT là đây sao?,8,https://www.reddit.com/r/TroChuyenLinhTinh/comments/18fkb3q/t%E1%BA%A1i_sao_l%E1%BA%AFm_%C4%91%E1%BB%A9a_g%C3%A1i_vi%E1%BB%87t_th%C3%ADch_l%E1%BA%A5y_ch%E1%BB%93ng_t%C3%A2y/
clonenaiz,Xin lỗi dc chưa 🙏🏻,1,https://www.reddit.com/r/TroChuyenLinhTinh/comments/18fkb3q/t%E1%BA%A1i_sao_l%E1%BA%AFm_%C4%91%E1%BB%A9a_g%C3%A1i_vi%E1%BB%87t_th%C3%ADch_l%E1%BA%A5y_ch%E1%BB%93ng_t%C3%A2y/
[deleted],"Vẫn tạm chấp nhận được, còn thiếu thành khẩn",1,https://www.reddit.com/r/TroChuyenLinhTinh/comments/18fkb3q/t%E1%BA%A1i_sao_l%E1%BA%AFm_%C4%91%E1%BB%A9a_g%C3%A1i_vi%E1%BB%87t_th%C3%ADch_l%E1%BA%A5y_ch%E1%BB%93ng_t%C3%A2y/
[deleted],![img](emote|t5_4bcops|21250) chứ lấy chồng Việt được gì? Tau hỏi thật?,7,https://www.reddit.com/r/TroChuyenLinhTinh/comments/18fkb3q/t%E1%BA%A1i_sao_l%E1%BA%AFm_%C4%91%E1%BB%A9a_g%C3%A1i_vi%E1%BB%87t_th%C3%ADch_l%E1%BA%A5y_ch%E1%BB%93ng_t%C3%A2y/
Ready_Cupcake9873,Lấy chòing Việt thì mầy được quyền vặt sạch tiền nó mà nhiều đứa không dám bật lại .. còn Tây thì còn lâu nhá .. chòing Việt nó nuôi mầy nếu đủ khả năng còn Tây .. mầy không làm thì méo có tiền mua son phấn đấp vô ngừoi đâu .. nó lãng mạng lúc ngày nầy ngày kia .. chứ tiền bạc rất rạch rồi ..,4,https://www.reddit.com/r/TroChuyenLinhTinh/comments/18fkb3q/t%E1%BA%A1i_sao_l%E1%BA%AFm_%C4%91%E1%BB%A9a_g%C3%A1i_vi%E1%BB%87t_th%C3%ADch_l%E1%BA%A5y_ch%E1%BB%93ng_t%C3%A2y/
Complex-Ad-1106,Nên lo lấy chồng tốt chứ không nên săn Tây nha bác . Chồng người Việt cũng đc Mỹ đen cũng đc miễn là đừng thần thánh hóa đi săn Tây rồi va phải người ko đàng hoàng nhé.![img](emote|t5_4bcops|27384),4,https://www.reddit.com/r/TroChuyenLinhTinh/comments/18fkb3q/t%E1%BA%A1i_sao_l%E1%BA%AFm_%C4%91%E1%BB%A9a_g%C3%A1i_vi%E1%BB%87t_th%C3%ADch_l%E1%BA%A5y_ch%E1%BB%93ng_t%C3%A2y/
Vast_Handle_2091,"Thôi lấy da màu cho nó ít ra thỏa mãn được dv, xong các chị đen quá bị tụi nó chia tay thành single mom ở đất khách quê người thì đừng có đổ thừa do tụi tui ở VN không giàu được như tụi Mỹ Âu ![img](emote|t5_4bcops|21390)",2,https://www.reddit.com/r/TroChuyenLinhTinh/comments/18fkb3q/t%E1%BA%A1i_sao_l%E1%BA%AFm_%C4%91%E1%BB%A9a_g%C3%A1i_vi%E1%BB%87t_th%C3%ADch_l%E1%BA%A5y_ch%E1%BB%93ng_t%C3%A2y/
Complex-Ad-1106,![img](emote|t5_4bcops|22267) mấy em gái nên nhớ trai Tây mà ngon thì không việc gì phải qua vn kiếm vợ cả ![img](emote|t5_4bcops|21248),20,https://www.reddit.com/r/TroChuyenLinhTinh/comments/18fkb3q/t%E1%BA%A1i_sao_l%E1%BA%AFm_%C4%91%E1%BB%A9a_g%C3%A1i_vi%E1%BB%87t_th%C3%ADch_l%E1%BA%A5y_ch%E1%BB%93ng_t%C3%A2y/
[deleted],[deleted],1,https://www.reddit.com/r/TroChuyenLinhTinh/comments/18fkb3q/t%E1%BA%A1i_sao_l%E1%BA%AFm_%C4%91%E1%BB%A9a_g%C3%A1i_vi%E1%BB%87t_th%C3%ADch_l%E1%BA%A5y_ch%E1%BB%93ng_t%C3%A2y/
Complex-Ad-1106,với 9/10 phần là bọn Tây chê gái ĐNÁ xấu đặc biệt là bọn Tây Âu vì t tiếp xúc r nên biết.,2,https://www.reddit.com/r/TroChuyenLinhTinh/comments/18fkb3q/t%E1%BA%A1i_sao_l%E1%BA%AFm_%C4%91%E1%BB%A9a_g%C3%A1i_vi%E1%BB%87t_th%C3%ADch_l%E1%BA%A5y_ch%E1%BB%93ng_t%C3%A2y/
Complex-Ad-1106,"![img](emote|t5_4bcops|27384) Thế cơ á. Sao mấy thằng bạn Tây của t kể bên Tây toàn mấy thằng losers không kiếm đc vợ mới qua Đông Nam Á cua gái vì rẻ dễ chiều hơn gái Tây đó. Thích thì thích chứ sao ko, tao đâu nói ko đc hay gì đâu ? Bên Tây gọi là Passport bros đó. M nghĩ sao chứ bọn Tây coi gái Việt như con hàng dễ dãi thôi. M cưới được thì ngon, phước 3 đời ăn tiền đô thôi ai tị nạnh gì đâu.",2,https://www.reddit.com/r/TroChuyenLinhTinh/comments/18fkb3q/t%E1%BA%A1i_sao_l%E1%BA%AFm_%C4%91%E1%BB%A9a_g%C3%A1i_vi%E1%BB%87t_th%C3%ADch_l%E1%BA%A5y_ch%E1%BB%93ng_t%C3%A2y/
[deleted],"Có lol mà chu cấp, ảo à",2,https://www.reddit.com/r/TroChuyenLinhTinh/comments/18fkb3q/t%E1%BA%A1i_sao_l%E1%BA%AFm_%C4%91%E1%BB%A9a_g%C3%A1i_vi%E1%BB%87t_th%C3%ADch_l%E1%BA%A5y_ch%E1%BB%93ng_t%C3%A2y/
True_Lab1770,Mấy thằng vịt uyn nơ bên mĩ có quốc tịch vẫn chịch mấy em du học sinh để bú ké vé bảo lãnh mà ![img](emote|t5_4bcops|22267),4,https://www.reddit.com/r/TroChuyenLinhTinh/comments/18fkb3q/t%E1%BA%A1i_sao_l%E1%BA%AFm_%C4%91%E1%BB%A9a_g%C3%A1i_vi%E1%BB%87t_th%C3%ADch_l%E1%BA%A5y_ch%E1%BB%93ng_t%C3%A2y/
gustavojesusgaviria,"Nó lấy chồng Tây là đúng đó, đàn ông Việt cái lồn què gì đi hơn thua với phụ nữ",10,https://www.reddit.com/r/TroChuyenLinhTinh/comments/18fkb3q/t%E1%BA%A1i_sao_l%E1%BA%AFm_%C4%91%E1%BB%A9a_g%C3%A1i_vi%E1%BB%87t_th%C3%ADch_l%E1%BA%A5y_ch%E1%BB%93ng_t%C3%A2y/
Kindly-dude1,Tao phân tích ra nhữnh nguyên nhân khả dĩ chứ ai hơn thua ở đây?,1,https://www.reddit.com/r/TroChuyenLinhTinh/comments/18fkb3q/t%E1%BA%A1i_sao_l%E1%BA%AFm_%C4%91%E1%BB%A9a_g%C3%A1i_vi%E1%BB%87t_th%C3%ADch_l%E1%BA%A5y_ch%E1%BB%93ng_t%C3%A2y/
[deleted],[deleted],1,https://www.reddit.com/r/TroChuyenLinhTinh/comments/18fkb3q/t%E1%BA%A1i_sao_l%E1%BA%AFm_%C4%91%E1%BB%A9a_g%C3%A1i_vi%E1%BB%87t_th%C3%ADch_l%E1%BA%A5y_ch%E1%BB%93ng_t%C3%A2y/
gustavojesusgaviria,Có con nào từng nói mày là một thằng vô duyên chưa?,0,https://www.reddit.com/r/TroChuyenLinhTinh/comments/18fkb3q/t%E1%BA%A1i_sao_l%E1%BA%AFm_%C4%91%E1%BB%A9a_g%C3%A1i_vi%E1%BB%87t_th%C3%ADch_l%E1%BA%A5y_ch%E1%BB%93ng_t%C3%A2y/
